{
  "_note": "Памятка правил для одной колоды (раздел «Для компании»). Механики нет, только тексты. players — для фильтра «Нас: N» (6 = «6+»: игры, где max ≥ 6). deck 36 или 52.",
  "id": "card-games",
  "slug": "cards",
  "title": "Карточные игры",
  "emoji": "🃏",
  "sections": [
    "company"
  ],
  "subtitle": "Есть колода? Вот 8 игр, правила за минуту",
  "filter": {
    "label": "Нас:",
    "options": [
      {
        "value": 1,
        "label": "1"
      },
      {
        "value": 2,
        "label": "2"
      },
      {
        "value": 3,
        "label": "3"
      },
      {
        "value": 4,
        "label": "4"
      },
      {
        "value": 5,
        "label": "5"
      },
      {
        "value": 6,
        "label": "6+"
      }
    ]
  },
  "decks": {
    "36": "36 карт: от шестёрки до туза",
    "52": "52 карты: от двойки до туза"
  },
  "labels": {
    "players": "👥",
    "minutes": "⏱",
    "deck": "колода",
    "goal": "Цель",
    "deal": "Раздача",
    "moves": "Как ходить",
    "disputes": "Частые споры",
    "back": "Назад к играм",
    "empty": "Для такой компании игр нет. Попробуй другое число 🙂"
  },
  "games": [
    {
      "id": "durak",
      "emoji": "🤡",
      "title": "Дурак подкидной",
      "players": {
        "min": 2,
        "max": 6
      },
      "minutes": "15 мин",
      "deck": 36,
      "goal": "Избавиться от карт. Последний с картами на руках — дурак.",
      "deal": "Всем по 6. Следующую карту открыть и положить под колоду поперёк: её масть — козырь.",
      "moves": [
        "Первым ходит тот, у кого самый младший козырь.",
        "Атакующий кладёт карту отбивающемуся (сосед слева).",
        "Отбиться = положить старшую карту той же масти или любой козырь (на козырь только старший козырь).",
        "Все остальные могут подкидывать карты того же достоинства, что уже лежат на столе.",
        "Отбился от всего: карты уходят в «бито», отбивающийся ходит следующим.",
        "Не может отбиться: забирает все карты со стола и пропускает ход.",
        "После хода все добирают до 6 из колоды: сначала атакующие, последним отбивающийся."
      ],
      "disputes": [
        "Сколько можно подкинуть? Не больше 6 за ход и не больше, чем карт у отбивающегося на руке.",
        "Когда колода кончилась, не добираете, играете тем, что есть."
      ]
    },
    {
      "id": "durak-perevodnoy",
      "emoji": "🔄",
      "title": "Дурак переводной",
      "players": {
        "min": 2,
        "max": 6
      },
      "minutes": "15 мин",
      "deck": 36,
      "intro": "Всё как в подкидном, плюс одно правило.",
      "goal": "Избавиться от карт. Последний с картами на руках — дурак.",
      "deal": "Как в подкидном: всем по 6, следующая открытая карта задаёт козырь.",
      "moves": [
        "Играете как в подкидного.",
        "Перевод: пока не начал отбиваться, можно положить карту того же достоинства, и атака переходит на следующего игрока.",
        "Переводить можно сколько угодно раз по кругу."
      ],
      "disputes": [
        "Перевести можно, только если у следующего хватит карт отбиться от всего на столе.",
        "Начал отбиваться, значит переводить уже нельзя."
      ]
    },
    {
      "id": "war",
      "emoji": "⚔️",
      "title": "Война",
      "aka": "она же «Пьяница»",
      "players": {
        "min": 2,
        "max": 4
      },
      "minutes": "10–30 мин",
      "deck": 36,
      "goal": "Забрать все карты.",
      "deal": "Всю колоду поровну рубашкой вверх. Свои карты не смотреть.",
      "moves": [
        "Все одновременно открывают верхнюю карту.",
        "У кого старше, тот забирает все и кладёт себе вниз.",
        "Шестёрка бьёт туза.",
        "Одинаковые карты = «спор»: каждый кладёт одну карту рубашкой вверх и одну открытую. Старшая забирает всё."
      ],
      "disputes": [
        "Кончились карты во время спора: проиграл спор.",
        "Масть не важна, только достоинство."
      ]
    },
    {
      "id": "believe",
      "emoji": "🤥",
      "title": "Верю не верю",
      "players": {
        "min": 2,
        "max": 6
      },
      "minutes": "15 мин",
      "deck": 36,
      "goal": "Первым избавиться от всех карт.",
      "deal": "Вся колода поровну.",
      "moves": [
        "Первый кладёт рубашкой вверх 1–4 карты и называет достоинство: «Три дамы».",
        "Следующий либо докладывает карты «того же достоинства» (можно врать), либо говорит «Не верю!».",
        "«Не верю»: открываете последние положенные карты. Есть хоть одна не та — врун забирает всю стопку. Всё честно — стопку забирает тот, кто не поверил.",
        "Новый круг начинает тот, кто стопку не забирал, с любого достоинства.",
        "Собрал на руке 4 одинаковые карты: показал и сбросил."
      ],
      "disputes": [
        "Проверяем только последний ход, а не всю стопку.",
        "Последнюю карту можно положить, но победа засчитывается, только если следующий поверил или проверка подтвердила правду."
      ]
    },
    {
      "id": "101",
      "emoji": "💯",
      "title": "101",
      "players": {
        "min": 2,
        "max": 6
      },
      "minutes": "20 мин",
      "deck": 36,
      "goal": "Не набрать 101 очко.",
      "deal": "Всем по 5, одну карту из колоды открыть: с неё начинается стопка.",
      "moves": [
        "Кладёшь карту той же масти или того же достоинства, что сверху.",
        "Нечего положить: берёшь одну из колоды. Подошла — клади, нет — ход дальше.",
        "Кто-то избавился от всех карт: круг закончен, остальные считают очки на руке."
      ],
      "extra": [
        {
          "title": "Особые карты",
          "items": [
            "6 — следующий берёт 1 карту и пропускает ход.",
            "7 — следующий берёт 2 и пропускает ход.",
            "Туз — следующий пропускает ход.",
            "Дама — кладётся на что угодно, ты называешь новую масть.",
            "Король пик — следующий берёт 4 и пропускает ход."
          ]
        },
        {
          "title": "Очки",
          "items": [
            "Туз 11, король 4, дама 3, валет 2, десятка 10, остальные по номиналу.",
            "Набрал больше 101 — вылетаешь. Ровно 101 — счёт обнуляется.",
            "Побеждает последний оставшийся."
          ]
        }
      ],
      "disputes": [
        "Правил «101» очень много, в каждом дворе свои. Это наш вариант, договоритесь до начала.",
        "Кончилась колода: перемешайте стопку, кроме верхней карты."
      ]
    },
    {
      "id": "poker",
      "emoji": "♠️",
      "title": "Покер",
      "aka": "Техасский холдем, упрощённо",
      "players": {
        "min": 3,
        "max": 8
      },
      "minutes": "30+ мин",
      "deck": 52,
      "note": "Играем на фишки, спички или конфеты",
      "goal": "Собрать лучшую комбинацию из 5 карт или заставить всех сбросить карты.",
      "deal": "Каждому 2 карты в закрытую. Всем раздаём поровну спичек.",
      "moves": [
        "Двое слева от сдающего ставят обязательные ставки: маленькую и большую (1 и 2 спички).",
        "Круг ставок: каждый может уравнять ставку, поднять или сбросить карты.",
        "На стол открываются 3 общие карты, круг ставок. Потом ещё 1, круг ставок. Потом ещё 1, последний круг.",
        "Кто остался, вскрывается. Из своих 2 и 5 общих собираете лучшие 5. Победитель забирает банк.",
        "Если ставок нет, можно «чек» (пропустить, не ставя)."
      ],
      "extra": [
        {
          "title": "Комбинации от младшей к старшей",
          "items": [
            "Старшая карта",
            "Пара",
            "Две пары",
            "Сет (3 одинаковые)",
            "Стрит (5 подряд)",
            "Флеш (5 одной масти)",
            "Фулл-хаус (3 + 2)",
            "Каре (4 одинаковые)",
            "Стрит-флеш",
            "Роял-флеш (10–туз одной масти)"
          ]
        }
      ],
      "disputes": [
        "У обоих одинаковая комбинация: побеждает та, где старше карта.",
        "Стрит туз-2-3-4-5 тоже считается."
      ]
    },
    {
      "id": "old-maid",
      "emoji": "👸",
      "title": "Пиковая дама",
      "players": {
        "min": 3,
        "max": 6
      },
      "minutes": "10 мин",
      "deck": 36,
      "goal": "Не остаться с пиковой дамой.",
      "deal": "Убрать из колоды даму треф. Остальное раздать поровну.",
      "moves": [
        "Каждый сбрасывает со своей руки пары: одно достоинство и один цвет (красная к красной, чёрная к чёрной).",
        "По кругу тянешь одну карту вслепую из руки соседа слева.",
        "Получилась пара — сбрасываешь.",
        "Кончились карты — ты вышел.",
        "Проигрывает тот, у кого в конце осталась пиковая дама."
      ],
      "disputes": [
        "Карты держать веером рубашкой к соседу, перемешивать можно.",
        "Пиковую даму не сбросить в пару: её чёрная пара, дама треф, убрана из колоды."
      ]
    },
    {
      "id": "klondike",
      "emoji": "🧩",
      "title": "Косынка",
      "players": {
        "min": 1,
        "max": 1
      },
      "minutes": "10 мин",
      "deck": 52,
      "intro": "Для тех, кто остался один, пока все ушли.",
      "goal": "Разложить все карты в 4 стопки по мастям от туза до короля.",
      "deal": "7 столбиков: в первом 1 карта, во втором 2 и так до 7. Верхняя карта каждого открыта. Остальное — колода.",
      "moves": [
        "В столбиках карты кладутся по убыванию с чередованием цвета: красная 9 на чёрную 10.",
        "Можно переносить открытую цепочку целиком.",
        "Открылась закрытая карта — переверни её.",
        "В пустой столбик можно положить только короля.",
        "Тузы выкладываются наверх в «дом», дальше по масти 2, 3… до короля.",
        "Нет ходов — открываешь карту из колоды."
      ],
      "disputes": [
        "Из колоды открывают по одной карте (легче) или по три (классика). Договоритесь заранее.",
        "Колоду можно проходить сколько угодно раз."
      ]
    }
  ]
}